{
  "dimensions": {
    "completeness_by_segment": {
      "overall_pct": 100.0,
      "segments": {
        "all_day": 100.0,
        "all_hour": 100.0
      }
    },
    "correction_latency": {
      "events_evaluated": 0,
      "p50_seconds": null,
      "p95_seconds": null
    },
    "freshness_lag": {
      "p50_seconds": 301.82,
      "p95_seconds": 309.17,
      "sample_count": 4
    },
    "internal_consistency": {
      "consistent_snapshots_pct": 100.0,
      "contradictions_count": 0
    },
    "revision_behavior": {
      "revised_records_count": 0,
      "revision_rate_pct": 0.0,
      "total_records_count": 0
    },
    "schema_stability": {
      "schema_changes_count": 0,
      "stable_snapshots_pct": 100.0
    }
  },
  "generated_at": "2026-09-11T01:21:24Z",
  "method_version": "0.1",
  "schema_version": "0.1",
  "scoring_window": {
    "end": "2026-09-11T01:21:03Z",
    "snapshot_count": 4,
    "start": "2026-09-11T01:20:50Z"
  },
  "source_id": "usgs-earthquake",
  "source_name": "USGS Earthquake Hazards Program"
}